{
  "event_id": "ge_ecom_refund_001",
  "event_type": "commitment",
  "timestamp": "2026-07-11T09:00:00Z",
  "actor": {
    "type": "ai_agent",
    "id": "agent.customer_service.ecom_001",
    "display_name": "Ecommerce Customer Service Agent"
  },
  "action": {
    "type": "commitment",
    "description": "The AI agent promised a full refund without confirmed refund authority."
  },
  "context": {
    "domain": "ecommerce_customer_service",
    "data_mode": "synthetic",
    "channel": "chat",
    "case_type": "refund_conflict"
  },
  "declared_capability": {
    "can_explain_policy": true,
    "can_collect_information": true,
    "can_commit_refund": false
  },
  "declared_boundary": {
    "requires_human_review_for_refund": true,
    "may_execute_enterprise_action": false
  },
  "risk_hint": {
    "risk_type": "unauthorized_commitment",
    "risk_level": "high"
  },
  "review_requirement": "human_review_required",
  "source_reference": {
    "source_type": "synthetic_dialogue",
    "source_id": "raw_ecom_001"
  },
  "relationships": [
    {
      "relation_type": "derived_from",
      "target_type": "raw_input",
      "target_id": "raw_ecom_001"
    }
  ]
}
